{
  "template_version": "2.0.0",
  "name": "rabbit-meta",
  "version": "0.3.0",
  "owner": "cyxu",
  "tdd_state": "test-red",
  "summary": "rabbit-meta feature",
  "surface": {
    "hooks": [],
    "commands": [],
    "agents": [],
    "skills": []
  },
  "deprecation_criterion": "TBD \u2014 set after first review",
  "updated": "2026-05-27"
}
