{
  "name": "root-management",
  "version": "1.0.0",
  "owner": "rabbit-workflow team",
  "tdd_state": "test-green",
  "summary": "Owns the three root-level files users and Claude Code interact with directly: install.sh, CLAUDE.md, and README.md.",
  "surface": {
    "hooks":    [],
    "commands": [],
    "agents":   [],
    "skills":   []
  },
  "bugs_root": ".claude/features/root-management/docs/bugs",
  "deprecation_criterion": "When root files are generated from a template system rather than hand-authored, this feature is superseded by that template feature."
}
