{
  "name": "rabbit-backlog",
  "version": "0.1.0",
  "owner": "rabbit-workflow team",
  "tdd_state": "test-red",
  "summary": "Owns backlog item filing and lifecycle for all rabbit features. Provides file-backlog-item.sh, backlog-item-status.sh, and list-backlog.sh.",
  "surface": {
    "hooks": [],
    "commands": [],
    "agents": [],
    "skills": [
      "rabbit-backlog"
    ],
    "scripts": [
      "scripts/file-backlog-item.sh",
      "scripts/backlog-item-status.sh",
      "scripts/list-backlog.sh"
    ]
  },
  "deprecation_criterion": "when rabbit features are retired or a unified project management system replaces file-based backlog",
  "updated": "2026-05-12"
}
